<?xml version="1.0"?>
<!DOCTYPE Zones SYSTEM "dns.dtd">
<Zones>
  <ZoneConfiguration domain="toolsofcomputing.com" contact="gkt" active="yes">
     <TTL refresh="8H" retry="1H" expire="1W" minimum="1D"/>
     <Host name="liszt" ip="192.168.1.33" mail_exchange="yes" ns="yes">
        <Description>Mandrake Linux Server</Description>
        <Alias name="www"/>
     </Host>
     <Host name="chopin" ip="192.168.1.34" mail_exchange="no" ns="yes">
        <Description>RedHat Linux Server</Description>
     </Host>
     <Host name="bach" ip="192.168.1.34" mail_exchange="no" ns="no">
        <Description>Windows Server</Description>
     </Host>
     <Host name="ravel" ip="192.168.1.35">
        <Description>Apple Mac OS Server</Description>
     </Host>
  </ZoneConfiguration> 

  <ZoneConfiguration domain="quillscape.com" contact="nina" active="yes" based_on="toolsofcomputing.com">
     <Host name="ravel" ip="192.168.1.36">
        <Description>Apple Mac OS Server</Description>
     </Host>
  </ZoneConfiguration>

  <ZoneConfiguration domain="inactive.com" contact="nobody" active="no" based_on="toolsofcomputing.com">
  </ZoneConfiguration>
</Zones>

